time,title,abstract,id,author
2025-09-19 07:43,"State Council Executive Meeting: Research on implementing domestic product standards and related policies in government procurement, and discuss the draft amendment to the Law of the People's Republic of China on Banking Supervision and Regulation.","The meeting pointed out that it is necessary to start from reality, reasonably categorize and set national product standards, clarify specific requirements for key components and key processes of certain products, and implement the practical action of granting national treatment to foreign-funded enterprises in the government procurement field. In addition, the meeting also emphasized that the stability of banking and financial institutions is crucial to the stability of our country's financial system and the security of the people's property. It is necessary to further improve the management system and severely crack down on illegal financial activities and violations of laws and regulations.",3755922,赵颖
2025-09-19 07:02,Alibaba eventually clashed with Meituan.,Taobao's in-store group buying service is about to go live.,3755920,黄昱
2025-09-19 06:41,"The central bank unexpectedly hawkish: two ""no"" votes and reducing ETF holdings.","The Bank of Japan released a more hawkish signal than the market expected at its policy meeting, with two members voting against maintaining the current interest rate. It also announced plans to sell ETF holdings at a pace of about 330 billion yen per year and sell REITs at a pace of about 5 billion yen per year. Most economists expect the Bank of Japan to raise interest rates by another 25 basis points before the end of the year, but there is some disagreement on the timing, with bets focusing on October and January next year.",3755914,赵颖
2025-09-19 06:33,"Xiaoma Zhixing: The key profitability target is expected to be achieved in early 2026. This year, the production of Robotaxis is expected to reach 1000 units.","Xiaoma ZhiXing's Chief Financial Officer said the company expects to achieve the key milestone of single-car economic breakeven by the end of 2025 or early 2026. Xiaoma ZhiXing has completed the production of 400 Robotaxis and plans to deploy 1,000 autonomous driving rental cars globally by the end of this year.",3755915,张雅琦
2025-09-19 06:26,"Major Announcement! Next Monday at 3 p.m.! Pan Gongsheng, Wu Qing, Li Yunze, Zhu Hexin, will attend!","The State Council Information Office will hold a series of thematic press conferences on ""High-Quality Completion of the 14th Five-Year Plan"" at 3:00 p.m. on Monday, September 22, 2025. People's Bank of China Governor Pan Gongsheng, China Banking and Insurance Regulatory Commission Director Li Yunze, China Securities Regulatory Commission Chairman Wu Qing, and People's Bank of China Vice Governor and State Administration of Foreign Exchange Director Zhu Hexin will introduce the achievements of the financial industry during the 14th Five-Year Plan period and answer questions from reporters.",3755918,张雅琦
2025-09-19 06:10,Elon Musk's robot in position one was poached by Little Zha.,"At the time of the large-scale layoffs at Tesla, Ashish Kumar, the head of the Optimus AI team, left to join Meta as a research scientist. He is another key figure in Tesla's robotics project to leave following Milan Kovac, who was in charge of the Optimus project in June this year. This move has raised concerns about whether Musk's ambitious robotics plan can progress smoothly.",3755917,张雅琦
